{
  "$schema": "../../../../../schema/state.schema.json",
  "id": "flowith.canvas-quant.overview",
  "surfaceId": "flowith.canvas-quant",
  "fingerprint": {
    "route": "/conv/3e48cb10-e17f-4309-8e07-32364045ad9a",
    "heading": "Quant System PRD",
    "activeTab": "",
    "overlay": "none",
    "selectedEntity": "none",
    "majorControls": [
      "zoom 15-18%",
      "Group 1",
      "step-label nodes",
      "document nodes",
      "sandbox preview node",
      "Powered by Neo"
    ]
  },
  "selectedEntity": "none",
  "activeTab": "",
  "openOverlay": "none",
  "jobState": "none",
  "agentState": "done",
  "visibleControls": [
    "zoom 15-18%",
    "Group 1",
    "step-label nodes",
    "document nodes",
    "sandbox preview node",
    "Powered by Neo"
  ],
  "disclosure": {
    "appeared": [],
    "disappeared": []
  },
  "evidence": [
    {
      "file": "evidence/canvas.quant.overview.webp",
      "capturedAt": "2026-09-08"
    }
  ],
  "observations": [
    {
      "tier": "O",
      "text": "Entire agent run visible: group fan-out at top, long vertical chain below."
    }
  ]
}
