{
  "id": "seko.canvas.subject-create-form",
  "surfaceId": "seko.canvas",
  "fingerprint": {
    "route": "/infinite-canvas?canvasId=2097273517239623682",
    "heading": "未命名故事",
    "activeTab": "画布",
    "overlay": "subject-create-form",
    "selectedEntity": "none",
    "majorControls": [
      "名称",
      "类别 角色/场景",
      "音色 上传本地音色",
      "形象 本地上传 / AI生成",
      "取消",
      "应用"
    ]
  },
  "selectedEntity": "none",
  "activeTab": "画布",
  "openOverlay": "subject-create-form",
  "jobState": "completed",
  "agentState": "composing",
  "visibleControls": [
    "名称",
    "类别 角色/场景",
    "音色 上传本地音色",
    "形象 本地上传 / AI生成",
    "取消",
    "应用"
  ],
  "disclosure": { "appeared": ["form"], "disappeared": [""] },
  "evidence": [
    {
      "file": "evidence/canvas.subject-create-form.webp",
      "url": "https://seko.sensetime.com/infinite-canvas?canvasId=2097273517239623682",
      "capturedAt": "2026-09-08"
    }
  ],
  "observations": [
    { "tier": "O", "text": "A subject = name + category + optional voice + image; not submitted." }
  ]
}
