{
  "id": "tapnow.agent.confirm-mode-menu",
  "surfaceId": "tapnow.agent",
  "fingerprint": {
    "route": "/canvas/<uuid>",
    "heading": "What are we making today?",
    "overlay": "confirm-mode-menu",
    "selectedEntity": "none"
  },
  "visibleControls": ["Ask before acting", "Act without asking"],
  "evidence": [
    {
      "file": "evidence/canvas.agent.confirm-mode.webp",
      "capturedAt": "2026-09-08"
    }
  ],
  "observations": [
    {
      "tier": "O",
      "text": "Two-level autonomy switch, per composer."
    }
  ],
  "openOverlay": "confirm-mode-menu"
}
