{
  "$schema": "../../../../schema/state.schema.json",
  "id": "libtv.canvas.node-context-menu",
  "surfaceId": "libtv.canvas",
  "fingerprint": {
    "route": "https://www.liblib.tv/canvas?spaceId=7892966&projectId=c85cf652c2cc4c479e0bf5451976c3a4",
    "heading": "画布 1 - LibTV",
    "activeTab": "工作流",
    "overlay": "node-context-menu",
    "selectedEntity": "node:视频 (v)",
    "majorControls": ["clipboard", "删除"]
  },
  "selectedEntity": "node:视频 (v)",
  "activeTab": "工作流",
  "openOverlay": "node-context-menu",
  "jobState": "none",
  "agentState": "composing",
  "visibleControls": [
    "优化工作流布局",
    "复制节点 ⌘C",
    "创建副本 ⌘D",
    "粘贴 ⌘V",
    "删除 ⌘⌫",
    "复制到剪贴板"
  ],
  "disclosure": {
    "appeared": ["context menu"],
    "disappeared": []
  },
  "evidence": [
    {
      "file": "evidence/libtv.canvas.node-context-menu.webp",
      "url": "https://www.liblib.tv/canvas?spaceId=7892966&projectId=c85cf652c2cc4c479e0bf5451976c3a4",
      "capturedAt": "2026-09-08"
    }
  ],
  "observations": [
    {
      "tier": "O",
      "text": "No 'compare' or 'version' verbs in the node menu."
    }
  ]
}
