{
  "id": "seko.canvas.action-compose-video",
  "surfaceId": "seko.canvas",
  "fingerprint": {
    "route": "/infinite-canvas?canvasId=2097273517239623682",
    "heading": "未命名故事",
    "activeTab": "画布",
    "overlay": "compose-video-popover",
    "selectedEntity": "image-node",
    "majorControls": ["合成视频节点", "添加到编辑器"]
  },
  "selectedEntity": "image-node",
  "activeTab": "画布",
  "openOverlay": "compose-video-popover",
  "jobState": "completed",
  "agentState": "composing",
  "visibleControls": ["合成视频节点", "添加到编辑器"],
  "disclosure": { "appeared": ["popover"], "disappeared": [""] },
  "evidence": [
    {
      "file": "evidence/canvas.node.action-compose-video.webp",
      "url": "https://seko.sensetime.com/infinite-canvas?canvasId=2097273517239623682",
      "capturedAt": "2026-09-08"
    }
  ],
  "observations": [
    {
      "tier": "O",
      "text": "合成视频 offers two routes: a composition node on the canvas, or push to the 编辑器 tab."
    }
  ]
}
